target,text
0,no we will be a of
0,your
0,i but no more my so
0,for your i your i not of the of but will out on my from the i in now do have a
0,doe in
0,i been for the to you for thi i i your for and will my you have been and a at all
0,of it to of it to be
0,it the at the whi you are but
0,do some d
0,my i you and i just up i you were here in with me me i you
0,you your
1,you won to the or to
0,i from
0,i
0,i d in d d thi can
0,you are have a thi you and of have a
0,is it
0,i out of in in you where is
0,all these and the onli i can them to is you in
0,i will befor
0,you all for
0,over it
0,d a wa on hi i wa when the i wa i wa i d we we a d who it with if
0,how are you with as in to you a how are you
0,i if he then it veri for our
0,should i there or what
0,i you i here i just to that you are them do the of your
0,wa in the
0,in other after me to him for a ha no
0,a veri and up with the same is the same will i
1,have a on your now by the and it to no
0,i up what other
0,i had a some befor it
0,just
0,so thi are we for the onli or the too
0,we
1,more are in your now and whi not yourself there thi
0,me
0,is to all me if d if will
0,i to i of what is your
1,for with no
0,i did up
0,i i do have her
0,you my i you about hi is he in with me and me to him at
0,for you at that
0,what wa she for
0,can i can for
0,i my
0,to about the so i a now
0,you were to me up
0,can not in thi
1,you have won a or on on
0,the i onli when it to is that becaus of i can onli to be when me to be and that onli when to up
0,the as your
0,i that i do of dure the a and is so that should it
0,that which i
0,i of with you about thi after do what you and from now on i do the same
0,other
1,you a your over to
0,me
0,they have a on the of the where from the and from the up
0,that have that have an to be than are
0,the of is not when we but it is when we have a
0,my is at we for the to do you
0,for you is with all that is not when you i had you you were on the the when i in i we were after you from do and me it me to to you
0,in my you and
0,i up to in
0,had a have you to the
1,been to in of for at to
1,we are to that you have won a from onli
0,i have been about you
0,a for me in your and not in your as the but the will you
0,where is it is there ani for
0,be there i will after
0,be to your we
0,to for onli
0,hi is in
0,all other are onli
1,now just
0,a of do those d in their
0,i do he to he here
1,have a who so to out
1,your or t
0,now no
0,do then not have
1,have a who is with out who they who so on
0,i he
0,no i am not have not ani in my
0,are you in
0,whi do you at to if you your
0,me
0,no we a and i we to in some so they we
1,a you from not be as you do not have up to the
1,your or now
0,have a and i will a now to to
0,but then
0,my to him
0,at me you becaus i an to on in
0,for for
0,so
0,he a
0,i in i
0,do me a my to is her
0,how my do what doe he do that him from to hi doe he to to me me
1,on your the on to to to
0,ma for my
0,is veri so it the we
0,to
0,did it wa that i it all not a it off
0,how i i my
0,the ha not been
0,that at is it do how is a
0,are you to me
0,i you both too
0,are to the
0,our for her and
0,i my i am but i
0,onli me the
0,i to
0,you do a of
1,your no won a on thi is the to you
0,it that of the again
0,my
1,you have been a just to your out
0,i not to that do so
0,is it your that in the or
0,have a
0,me the
0,some me to a while
0,i it on now it should be for
0,i my now i m at
0,
0,how the i and you are my as my i your and and i you
0,me when
1,
0,how
1,ha our you who now all will be
0,from here after the is for
0,you had a have a
0,no i to
0,can you out how they in and how can it be it veri to have a befor
0,how to
0,we are to our
0,you now i
0,i you i at you
0,i have the
0,as your ha been as your for all to your
0,you are the onli in
0,so then
0,now up so a can out i now
1,from a your or t
0,i will you in as
0,that if i have to to the in an
0,no at in on but no in in
1,your is to be the to to and
0,if can of him can or then me
0,we it at is as to you
0,can you or are you too
0,you just to we to if you were with the with or no
0,am in
0,it will on itself i she with that will be to for
0,how are you
1,your no wa on thi is our to from
0,i it we did have the can we we have it thi now
1,the from onli at to your now
0,how wa and
0,i wa for a
0,when you and with
0,i onli to for it
0,i and is the of my
0,then i
0,as do
0,i to of you i have to now when you a
0,no a up now
0,he not is all he me
0,how are you
0,were some
0,or i me i down my
0,so is which is where i am how all is in thi who wa the
0,y she so we her becaus she it between
0,i will be we will
0,in but not
0,i the
0,not no it wa a
0,i a with onli and if i
0,they and when it on it your of those
0,
0,so your and if you had do
0,to can to
0,is your so i you at
0,whi did on your
0,your wa to off to with me a in the so i have to with your
0,is it if i the here ha a and i
1,to from to and to
0,for it an and it can be for and
0,there is which will in you can that to the in and it to
0,you or can i by at some and out what we do
0,again
0,now after that onli i can
0,
0,too i it
0,in he just if we an when and how
0,how to do
1,in a for a to an to to t for
0,y she i i her it i she then she
0,i so not ani he what about me
0,i there and i can you but you me you should i the
0,
0,too
0,me
1,on for the veri or
0,that
0,then not
0,and be an you to and
0,he he is on me that whi you to
0,do there
1,you and thi from there do you the for
0,i by in an or so my to up for a
1,you is to you our to out who it be from your or
0,i of more how do we have
1,a if you the of to
0,i you so i for thi to as me to be at your my
0,my and i up more until
0,i wa that there
0,then on we can and
0,all all in do if in as but what i do
1,am we will
0,a of how to
1,if in a in i o
0,i i can some more you
0,i am not have her
0,i out with
0,can a not
0,but i now then
0,up thi with of
0,i to you how i that the onli i you are when i
0,it i i
0,i i am her
0,
0,i your is but not
0,it y me do me from i me
0,in i you
1,to will be of all the and to
0,is in onli befor it after it
0,about out you to after or do you have a
0,what you me to up
0,it
0,it is onli
0,i that i him in the
0,just and
0,not it in at is that on off by
0,
0,it to be with a when that more will in can
0,i from a to
1,if am all now
0,how that ani i you my
0,to s
0,all have to
0,that veri you on
0,a
0,of d my
0,which is and the that the other is which a but when it to you have to to your
0,are you be
1,your ha been with a from onli
0,i so i am in but my is in i on for the few i that down
1,in a to to to t
1,to your me and just for you to now
0,i when she doe thi she what should be a into an of how in her
0,i me you are not here and the is down what should i do have a have you i you how wa the
0,he ha of but the doe have to it over and he it up
0,are you with me what
0,i to your
1,you have won a or a to our on between
0,i can by
0,no i do have a out of a
0,so is
0,you
0,i for too as but for a now have a to you
0,i out to
0,to
0,of between is not about after the it about just by the
0,my
0,then down
0,how about
0,not to i you it
1,our you be to for the you had to for with to thi to out
0,do have a i you so
1,on and on now or t
0,they not so i
0,i
0,me too
0,i you your in
0,so for the i your
0,where are you
0,can you me the
0,but is not a of the he that of is in which can be for for can to all from ani to to more than can for no of how our is by we have against
0,with a but
0,i in now down me veri
0,i you
0,how doe it to it
0,you my and we you to we will to your
0,it in a that a from me
0,that be i you i to
0,what is thi you of
0,to you of
0,just a not thi
1,who am i thi is the i a all i i for your i to be your
0,where you me
0,i to i can on on my
0,just up it but i did am
0,do
1,you are to a to your which you are to as a
0,if they all then i
0,i wa you but i it at
0,you can a in whi do they all the
1,ha our you who now all will be
0,a
0,my have a
0,you out how we for and i are to out how we can on
1,with from with or
0,i am so you and me
0,i that me so onli i that about so onli me
0,are your are you will you to your in the do you me do you of me are you me
0,and you at the are to you our at an our
0,s abov
0,a i is down my to him some you be to a to
1,is your from
0,what you did in
0,it be but i do what i have to
0,and and
0,that my
0,both he he and he ha have him me down
0,will you to be
0,if i not all then i if it
0,for that i a on
0,will
0,a wa on the the the of the be my y my a wa to you y i it off
1,the now for for to for just t
0,what i wa i too to i a
0,a not so for on
0,is on or which
0,that i to you not to me your it me but it me so for
0,i been you me it to me i not as what i do as i i wa
0,no i
0,but him he
0,for the is it that of
0,i to and you some
1,me and have a a with a how about we
0,how are you your do i had a i at and what are
0,i by i out my
0,i but is there
0,how befor you just
1,just your and now
0,i you in
1,and now more
0,veri veri i am up with
0,
0,do me a my to it is her
0,not
0,where are you me
0,i to for and am to
0,i you when i
0,so when you
0,my i it and my is of you my i your have a but i you to me
0,just the of my what up
0,we have the and on the and i in have a of
0,where should i on you or in you
1,ha our and your becaus they you to out who it is from
1,there it been now and no i some you up for it to to
0,we for
0,
1,over in our and your on the of a to now
0,me your i
0,me too onli
0,doe am my through a of in with a if you
0,are you now can i now
0,i
1,your for
0,i my when i
0,here have at on the to at and do
0,
1,for to a to t
0,can all my
0,at in me if
0,of to
1,the are for you to them now for a to thi
0,no to
0,to from you what
0,the when are to i it on out with but she
0,he he me a when hi the but that he befor the of the
0,on my so i
0,if i you do thi i you in the by
0,
0,it me to so is to
0,i have to with in
0,up now that me
0,then whi no to me
0,it just off or the me when you
0,me when you at and i by to the for me
0,ani at
0,is if i wa with you if i or you just it i
0,i we now a not is them now
0,it to it
0,i i i then
0,
0,how that what are you up to i you my i
0,you i for a the i you
0,is thi your it from and are you up to now
0,out and will
0,for the it wa have a
0,i wa i have at my what did you up do
0,but in
0,that we should to if can be our befor we to a
0,i am for becaus of
0,not that i of most up here are out of
0,my on my to and we have just been into by and have a what have been up to
1,is from him out no
1,you are the a or a to no
0,i my can it him
0,how that are we and to be do we in the and i of you my as
0,
0,up a and and the he thi is
0,what up how you have been when i from these i them and they had the just to do have a and all the with your if you can for then your is
0,a and ha to be than he so be here
0,where did my is you have to in here
0,there a at we can for that me what you
0,no my are
0,the i by the
0,am on be there in then we ll to me after to
0,do you
0,it wa up but we more more
0,there are a then
0,you him now i him
0,a from other
0,i
0,we all over here and have the
0,when it then
0,how is in
0,i am just a
0,i is not
0,s
0,how i to you
0,and to to in onli to on will but no more between by that is over for you in them but not have no in my
0,in i
0,then do now
0,that if about to do in out about up to about
0,is veri is and is
1,of or to
0,it so i at in just it i
0,that is and for a up for out do there is i for on
0,with
0,i on the and some other
0,am do in onli but have to
0,i to
0,he but i but we a not them a of
0,now so me when if can
0,you do you the
0,we
0,onli
0,there is a for you to it there is and
0,i it more than that but out for a from your
0,have
0,me at
0,that y i it all do now
0,up were me
0,do
0,what
0,you what up
0,ha a where a is so i what we
0,i to i to you in my now
0,just do my at d up the
0,i am not to
1,you ve won your or now s
0,no to be i am i over if i
0,where you what
1,is but not where it
1,have a who is with out who they who so on
0,have a out for when you we about
0,i am not about i onli about
0,whi you here and
0,they what at the most so how
1,i am to or me to at to
1,you your to to by
0,i and and and you
0,i am to now
0,of you can onli and to the
0,with yourself onc in a you will your in thi
1,and to a to to out to
0,in
0,my is with my is
0,we can we can
0,then me
0,i your you are veri
0,i it up
1,you are a
0,up i you i you i you
0,
0,wa to that so when what and
0,me i am from
1,thi is the we have have won the is now onli
0,me onc you
0,you have in all the in thi
0,do we have ani
0,to and thi and to
0,some for
0,how is your i am out of thi
0,i i do it that but it will be more than those we that befor they the we have had befor i wa
0,i so
0,it are up for to a the or with my for so me if can
0,my i do you just your and to you thi you onli
0,by the
0,no i do have ani
0,i had my from out
0,to and out if hi or
0,you
0,i then i
0,we our for the to in of but what we is are by not by
0,i at now but i in my so i
0,after that there
1,me me on me your now and you now all
0,they are and she and here it too
0,you for to to you am here and you when i an you in who
0,me there my
0,for your
0,by the will for befor then
1,a and a to
0,i at do me up or me on thi
1,the with your for more from
0,my how are i your and have some i and you a from the
1,now onli from
0,
0,on of
0,out from
0,you in you will in in or
0,is and be she
0,there for the of ha too you
1,to thi at you to to to
1,the most from or
0,i all on
0,are
0,then i will to after an
0,for your
0,i can up at if me where
0,o should
0,i on is it be to the and how are you or do you it now
0,my
0,you are not have that of have with of to
0,other me a
0,in off on but i wa were at my
0,you the to the that if you to it hi is
0,it again then and have it by the you up you are veri have a
0,it not that of the nor of the
0,then
0,do you i have a and at my
0,i the now a
0,i to you how were the were
0,i can
0,no no just on that wa to be but that
0,not what as not if can to befor will you at some have
0,to
0,me me me but in the of my when i on my and i have a
1,a ani for or for
1,just a a or a to
0,to out how
0,is she ha hi
0,it a it with you
0,ha it a
1,is to now to onli
0,is i in my is my
0,my wa on me a as did
0,we up where you at
0,so i
0,i can in if
0,have when
0,when you to
0,i am not to so i can me me where and when to
1,with your and and you will by a at
0,i am i will be there at
0,is a it a if we who to then be but then
1,you have won a in our the to no t
0,it onli a for me i down all the and will be for
0,we as of but the other wa out of hi to her in her he then where the is the
0,the is the is the is a
0,to do
1,now just is a
0,for thi you had a
0,what a is that have that i do about
0,then up then me
0,no how then will they your
0,is and ha a to
0,when the is a the in the thi the of will
1,an on on the for
0,me not all of my are in your
0,in d i do i how it in with an
0,i i a off a so i it
0,there in a
0,no he itself
0,am on a from so i not i off will be do you the thi by the
0,he not with you not be with it
0,
0,i but do
0,not
0,
0,i a few i can up and to the
1,the by to
0,then to
0,am onli for
0,no i in the same here at my me out on i
1,your on or and with on
0,i now
0,he in that just the but we in to
1,are to a if you have a
0,you what thi to me no to
1,from a or a t
0,the is and i am all are the same so be i have to i am where is the or me thi is with the be
0,you there i had an
1,a and a to
0,i
0,so i m with him we
0,have you if not i will it now
0,whi did i up on my own
0,they they have veri
0,will you be here for
0,are you to that
1,on or
0,i to thi to my i the by onli i will it on
0,can you me me to him there but i and he not hi
0,there are some here or there is the
0,do that ani will by
0,under the there a in the there is an in the there is a on the there are
1,do you a ani or for
0,he not me my he but i he is some most i
0,
1,into our just the to now t
0,no did you i hi now
0,it to thi all can but befor to me
0,how about your
0,but we to it
0,so
0,you your it up
0,will it if we again
0,do no
0,how the how are you do thi is just you a
0,you i you as
0,not for not
0,is of a
0,you thi or
0,o we if we can and or doe
0,what i just
0,do that
0,you should your to
1,our on between as you have won a or
0,i your
0,
0,for for for for but for me to all me if me if in some to is to it
0,i whi not your
0,then we to can not my can to from our
0,no in so that i
0,she but
0,thi to and about how is my of me
0,we are all there
1,your ha been with a from onli
0,i i my from
1,you have won a thi is what you when you our to to now
1,of or to
0,am on the am i the onli or am i it with the
0,they do that on the to it from over there
0,all those whom i dure of in to a so be me and as that i the to over the same
0,are we for the or
0,of
0,i that thi is an of my
1,for just to and
0,a they and i ani of and all that
0,no it not can but it will for it thi no
0,i you do have if me
1,
0,we on
0,me you out through thi
0,i it
0,where my i you what
0,how is the
0,so should i you my
0,did the
1,to a to on
1,to and then just to
1,about a with a just and to the
1,do you a with to ani or
0,what i is if you have i i just not
0,that
0,are you with me me
0,what to you whi you to me an
0,she wa if you but now so how are you with the
0,i out have a
0,me when you on the
0,are you now
0,i you i you were here to with me my is so i now to to of you my
0,did for the
0,you have to a of all to out from her if wa is there a or in the me
0,ha to your to them and my to you and
0,
0,i am on the to
0,a i
0,ani
0,i in the
0,i have to it how i my did for it i is the onli to them
0,
0,
0,i i
0,are
0,i the on
0,her onc i have it she you we
0,no me now if you me me how
0,i you that the of be and him about and your and all the
0,when is the again
0,i if you me
1,you are be by our by you to out who it is from your or
1,we to you re your to our of a ani or now
0,is with you
0,how is it to you and where
0,i thi
0,of do me you i do me my
0,for
0,but we
1,thi is our to your from is to now
0,we can and
0,we all here the
0,i a of on there too i just up
0,while were those my i
0,to the on the is by the of the on the
1,thi is the we have have won the is onli
0,i my wa you not be then again i am the to
0,
0,when are you
0,a out is not too or i can
0,so how you are not over your the
1,and are
0,
0,
0,it in are you on thi
1,s
0,my wa but but it me i not ani but on my
0,i there
0,i from and it out he
0,at what should i
0,you to i
0,i you i had to i at your and to you between my i you i you i you
1,your now
0,she ani
0,me your and
0,how is a you
0,how i am you both
0,i to for you can be to a onc i ani dure my to
0,did on the the wa on and to
0,a or what
1,or and more when for
0,i wa up all too about thi it a we a out with and you do my
0,he and to your to at a
0,as in i
0,she to that he in becaus i here
0,i on now just the to me and it you have to it in the but it and will
0,do all will for of
0,what thi can i my to thi
0,no to with what you
0,i will
0,then we
0,just do what is for you
1,i just of these to thi my up so at
0,
0,them the
0,i then
0,i who do
0,then me at if i then i my then
0,i if
0,my
0,what do as if do it
0,it my is i a so we can
0,
1,you have an now
0,you had a i to you that i wa to from my he he the by thi is and i wa you do have a
0,you what i
0,i when will you the
0,i will in
0,did that
0,what up
1,with are to a a if your to your
0,i ani i up
0,are you to thi
0,at the the onli i up at thi
0,i you at we are not not thi
1,as there is an for you
1,been to thi is our to to
0,with the you
0,what is so no
0,
0,some
0,y they here there
0,no i wa
1,i your when you have the i on
0,no
0,now
0,you do
0,i but now i
1,to now for t or
0,your over to
0,now i am in if i i will
0,we do when
0,up it
0,i it a between
0,i have i can you but you can my so i you
0,i we not you are how should i you
0,but i i you
0,i out a by a with the same which wa with a they that
0,i that a but you my at
0,against when is in it but it veri when it
0,you been in a for it my you should be more about
0,i am it you
0,are you there in
0,who are you
0,she do if i into the for a i in a she out a my
0,we for a and i over my and should have at you
1,the or on for or to
0,is
0,i down with my what you up to
0,
1,to the to now
0,do if is
0,you your to
1,thi is your to your or from
0,me i again
0,where the
0,me too
0,how about and
0,your and wa to your whi i not from you thi all the in your thi from my
0,i can do that i to you both and the
0,what are you to no
0,if you can it ani or you can it just me you
1,for your will be should your not
0,do
1,your now
0,of of
0,and that i to most of the at
1,your ha been with a from onli
1,is you to be her or her to
0,on me
0,no just to you you in
1,is out whi there a you
0,it a of
0,i in
0,do them or be or
0,can now
0,i you as a and you as my as as the our be
0,my is and no is the is can you to i thi to the
1,of to now t
0,you will have the do i you
1,is it you or now
0,not becaus all the in my
0,y to there
0,what to you how you
0,i you up there befor
1,into our just the to now t
1,
0,the do a
0,if you are not then it
0,no i the is the same that at thi is have you your becaus it and have you if you are do of or if you just do the
0,i you are but she have been and it if she to her her will and if you her now she will just it a she ha which in a few it will
0,is ani to him
0,in now have in few
0,i am you for how about a with no
0,my ha now it is
0,you are as me your and in
0,a few off
0,it more
0,or i just and a by the of the
1,can a in in or to
0,what ani
0,i will in an
0,i to your
0,i in
1,do you a with to ani or
1,for ani have you been we can or
0,i not if it
0,i all there a on how all or on it
0,just i do to be
0,a onc it onli been but is so i i do
1,or you be at
1,your for
1,to a have won the is just now onli
0,veri on
0,did you ani thi i so
0,will to
0,when you me
0,we out in a few
0,i in i is
0,it a to all if d same then which me the me
1,you are a have been or a to a
0,but i on a and i too of i on a
0,he is
0,
0,ha for ha in a you the and your at the
0,i it veri
0,to you too
0,i
1,it to your are until
0,
1,we are to that you have won a from onli
1,over can me some i have now
0,do what been up when will out of the i will to to up the
0,you and your and in
0,that they what did they in the and
0,on
0,it i did
0,i other
0,i have as a on to to from no to
0,but if i
0,me what
0,ha a but he at our
0,what your for
0,i to more
0,so whi you
0,whi you me thi
0,but that on it be
0,can
0,are you at
0,i will it again
0,on if you the i then about if you
0,he will you
0,no and
0,s i will onli
0,that be or
0,to but as to but as i to but can my as to
0,you than they are
0,your i wa at for to i so
1,the on your each and ani thi is of
0,i am i am not
1,and on on on or
0,i am at the there
0,that you a
0,onc a in d it wa veri he a while a of he d he had up he out those those were up in d
1,your is for to out
0,you there is i to you in then
0,you have to be more than that
0,if we it off you can in with me
0,onli i can
0,i have to
0,i your do you have ani in
0,if can then i
0,i have into what to do
0,and
0,my
0,is thi the these of
0,i to too me when you at
0,how are i is off i in
0,i to to at so you to at
0,all
1,whi for your
1,a just to
0,again it to
0,had down to the when you me
0,by i should be but will you for the is that my how with you how and the
0,in when do you i to or
0,here me a while i i
1,had your to for with for a to out
0,i am but will my
0,as your ha been as your for all to your
0,you there
0,for some
0,of a a on a but on her a
0,i to you
0,i for how
0,i your
0,you have into my and the down on me my a on my me and for
0,the i here
0,you it i it in
0,as i my my i she me after she me to her we there
0,no been
0,so then when is
0,for you after
0,i those
0,yourself for me becaus i you and i you and i that you in
1,thi is from you are to in our to befor or your will be to
0,i but to out on the if it you
0,or be a at the on the same
0,how my doe he me to me i you
0,is it which
0,that you about whi
0,should to and
0,it be is d most of have
0,then
0,a who but he down in and i do i it up befor
0,is hi as so me when you and are to and i him to
0,to in is that
0,then i i to no more again
0,i they not ma
0,
0,no just to your a more
1,of to be won just now to more
0,what of
0,my on and did it i up
0,but be
0,where are you
0,in
0,
0,i you your i am
0,i you
0,is not you should have me
0,do to
0,i not i my up
1,for your your will be should your not on
1,from to and of thi with your no and
0,now i for
0,have you are not in whi
0,
0,just here it a it i will you
0,i do you have it
0,me too i to you i you will of me
1,up your with a of a a to
0,in that i i you at
0,just what your do now
1,onli had your you are to to the for the on
0,a the of i an from and i you are you from
0,when did i i it onli at how it in
0,i will my have you can my so you i
1,the ani or for
1,the from onli at to no your now
1,you can to by to will be to your
0,i at
1,as a you are to a it to your the to no to
0,me
0,i i befor
0,it
0,i to out i her
0,you when i her to you out to a
0,just again do you and in
0,i it down to a not which
0,just and i had a and so for the
1,have won a a thi is what when our to to now
0,she it veri she just she the in about the and that i should with the about my but now and all are and up
0,can you me your out of i have in have to befor o so me
0,to i can her
0,it have a in not about is a
0,that be we be at the on or will in over our have a
0,in now
0,now
0,when will you
1,do you a ani for onli now or for
0,
0,so i a of is not hi
0,i am i to out your
0,up up down at in me
0,
0,it a while
0,we will
0,in me the for i can on my own after of she the
0,have a to you and veri to with
1,in thi have won the to just t over onli
0,yourself the if the ha a just your and the will be to you
