target,text
1,a is for you our ha you from our to a just
0,the
0,your is a
0,no i that you to in
0,of
0,thi
0,i the on my
0,i then so i to i
0,ha no ha no ha no have in
0,my is not to with me they me
0,
0,her my to
0,but i had to
0,i and i it you
0,and i are to the and have a of i me a when
0,to and a it
1,i some my i a me to for no
0,me some but a
0,to the
0,
0,then whi you to
0,i can you a if you
0,i be by or if on
0,i to what the
0,how are you it been how
0,i so
0,now onli i i am veri now i will
0,it a
0,all your
0,it i just did no
0,not from thi are you in the
0,the of in an
0,no to you
0,then to and to by
1,just to then a onli
0,it should about
0,me if is there it there
0,them no to about me
0,s now onli i onli
1,to on in the now no your
0,how are you do you in for the just you a
0,i but no up i both of them they
0,
0,
0,up on your if have to is and i do what i
0,onli when you your are than the
0,the am i and you again
0,i onli
1,for the an out
0,after
0,if you then down
0,but my is over
0,me too is to up my and the is
0,did that my now it just there for me
0,but not i in
0,did you to your are you up the now your how it i you
0,do you when will be
0,now am me
0,
0,you and your for to or the and me all the i have a
0,then my
0,there be a at my you
0,have to but there onli
1,the or on or to now
0,what can i do between so do
0,whi
0,him i
0,s from the it there is no it all about and
1,you can further by for
1,as a i am to you that of your no you are with a
0,don
0,i can but it will i have my
0,have you had befor
1,a with or a they are on what or to
0,i here
0,a is here and i on the
0,
0,with my what up me a in and at if or me on thi now
1,a or now or we will
0,my out of but there i
0,i in a me
1,you will your the for and
1,do you ani and a for onli or for
0,i so what to do
0,me again what your is
0,i if you thi
0,i i onli the
0,can that
0,can
0,them
0,who all in and out of the
0,where are you when you here
0,i i my
0,there are no other after and you can you
0,so or we i
0,if you her or she ani
0,no it do no
0,more than i
0,wa about them on
0,you be over some that
1,or your now from not to out
0,can some will i i to have ani
0,just you
0,have and he not my so i he that the is
0,
0,is over
1,we are to you that you won a onli
0,but not
0,in it to a that a or the that a
0,and out of
0,i
0,to by now
0,it if me them
0,we will have
0,doe have a now
0,so to the
0,for me i am that you
0,you so when we and we the of your you are we you we are down to thi is the i
1,you have an from
0,i what to do to out of thi so onli am thi me
0,is that your
0,that so what do you for your i am your are i
0,just becaus my what i wa up to
0,i have been in for the few and had to a i it be of me to about you at to yourself and that whi i up i am in a and be to the thi my of can you
0,i i
1,to thi is you to at to to
0,i to
0,
0,i it but i have of and to so i to off and
0,it a to the it just you veri to your
0,have so be here
0,most of and
0,no but i wa that so i and the with that i in here and we a but i did him me
0,thi you if not then thi you a to have a
0,it
0,for of
0,by d who s do a be in a
0,my is and i am in the
0,
0,is which will for me thi to all but me
0,i there
0,and her over
0,you that you not but he we over and i i have so other to with that i myself onc thi to it
0,
0,you him and now of them him now
0,but my not for now am in not to for but no me and whi not it me
0,to be
0,i at
1,if you do your will to t at if
1,now in with and from for just by and the
0,i to to it but so i in at the too i in all my
0,i you with out your
0,no no i will all
1,from
0,it i they then
0,i or ani i all are me i am a for all
0,if her it i not
1,been to thi is our to to
0,to
0,all of
1,your or t
1,or in in the most just to and who you
0,my in
0,did hi if not him a or
0,at by the
0,i down but i i my at i him me
1,and me and and for some up for some thi is
0,which is to our
0,i i do
0,the with a and i down to my for that
0,up d when is there to
1,out our of and your and to
0,you are have a
1,to
0,to
0,can me a of
0,i to your thi i you too my i your and you are i for to be again
0,my
0,i they so for we in the of were to
1,not from a while to of me then to
0,me how i i not at in
0,you thi is the she ha had that so i of what she and did the befor or if the befor so that we can be it
0,your is i i have to you about thi i have some that i thi i am out of all i thi is a for you but i have to you
0,to
1,can of now the to
0,it with her here
0,we have for to for
0,him i so wa
0,thi and and to them
0,i at now
0,at thi i not
0,
0,i am for your
0,a when you the to to your or it you are
0,is me out she all my to of me and then she about on my which i have on in a
0,i do the he is a is he of who a to hi
0,i so the
0,i have the few
0,can your me with me and i have some for both of me
0,i will you
0,i you the and do you the
0,it for
0,you my a it and with m
0,that wa so
1,just to thi now
0,have my now
0,is in or
0,are you of them
0,at my at no but if you can in ani it is and we for more
0,your and my all over what is your
0,if he he will in few have and
0,are you to
0,too of them it
0,have a my
1,to for a or to for a after are to
1,no just to so now and
0,when did you to the
0,there i ani
0,i were here i so
0,i to not a
0,are you not or just
0,my i you to or of yourself in on your
0,are there me i to
0,here is in
0,are you what where are you
0,i you to be in my
0,is of d a in so
0,i so no not
0,now onli your
0,then
0,
0,that
1,you are be by our by you to out who it is from a
0,are you for on
0,you at and a
1,is to now to onli
0,i for when they
1,you have
0,i you
0,i am to your after
0,
0,but we but we out so not out
0,just what i wa
0,how that are you there now are you do you of me i my and you a from the
0,me who
0,my
0,i not i wa just out what wa the
0,ani but i at on
1,as there is an for you
0,i to if i not by the you just the on my and i you when
0,my to all the but me when i am
0,and my is by no
0,
0,to the which is in and to the to
0,ha for ha in a you the and your at the
0,i wa in the when a at i not that doe
1,in the in the that at the of the a or
0,which your
0,i do the
0,what you to
0,
1,we are to that you have won a from onli
0,can i a from you you by
0,to you not but i ve him you can be hi in the in he for you and you a or for a where for and he of the
0,i for will you
0,but he we
0,i is is he be an
0,out with to and
1,from or a t
1,thi is the to have won t
0,i been to him
0,no more will from now on in
0,then no to me i am to
0,but
0,the y
0,if i i to have all my
0,what you of
0,is be so you are while i up the and
1,now from to to
1,is your out whi there a you
0,so what you to the
0,thi is you a me about your and as i wa you so to to on my and it my is after that i will in more
0,is your so i will at
0,i i i it in it in
0,are in
0,on that
0,i you so for all you do with i you
0,my she at we to and to but it be for we should
0,he out he me he be and me and then i did a from him
0,am i should on
0,to about hi
0,and to you
0,not just i to in and it will be the to do that from by the how and how is the
0,re it and i you to and you
0,to me up at
0,am not to do that
0,your wa of
0,i and all then it and i all
0,you up what are and that
0,i
0,not a will them a and on we all to the
0,that what i me if on
0,i what you i am
0,do me
0,i to do a not
0,
0,but my will be on i do a
0,that what i wa
0,then we do it after that
1,thi is the we have to have won the to just t
0,i to there the of be in a
0,it
0,from
0,you your
0,do not
1,your will be with you
0,is we can of to do he he have a
0,i a of to just i a or you
0,it me down just
0,in
0,
0,i your that
0,i my that you to as your
0,it on in but ha it me it and and were it
0,the
1,from your or t
0,when he down
0,o out i had on under the
0,do me i have to
0,you you it wa a were for the other wa you can onli do so on with that that they on the
0,my i just i you as you were with your you were and a
1,as there is an for you
0,same as in
0,no more of on or and to
0,i that me when you
0,it too
0,what is your for
0,you have but you are
0,at with my that me
0,the at the who wa with me my from the and and me i becaus of now he have my should i hi and him thi him
0,we the
0,if you not in my in an and a i
0,now i have again
0,i you when my
0,had your
0,ani in you
0,can my but can not my my
0,i just out of the and to do my so i up when i
0,and
0,do you the hi will be in there
0,i am to will be onli at
0,of i just me on now
0,i have as of
0,am in my me
0,i will of me so no
0,i my out from if you of me and i down
0,if then how i
0,what to you
0,to you my i to all of you
0,not me it but on
0,at
0,when on from
0,we
0,i in ani to
0,it been a i just to up and a
0,that from to i be a to down there so i do have to and dure as i have my from
0,should i my not to
0,my and you
0,it will you with i am to your with my
0,i have
0,me too have a
0,all my but for the who is thi
0,no
0,i what are
0,i not
1,there been the to now
0,it is then we all up and thi
1,of our to
0,i to
0,she the of
0,is your or
0,will do wa on thi too and you too
0,if you a in about it my will be up me that do
1,how are you i to have a whi you me what you and what you are in to
1,you are a from t
0,i in a me at
0,do all up all the how of
1,you have won as a our ha you to a to is just
1,in on to for or for
0,
0,i should be there by at the to are and down or should we just do
1,we are to you that you have won a onli
0,she her
1,from of each thi is a with have and
0,i how me
0,thi have at a
0,me your
0,it that i you in a
1,can now i up me now on can here
0,in but they of so them me our
0,veri it all about that
0,he out at hi is by your so he can
0,and you will you you all
0,for he and
0,when are in where the of your when your
0,who about
0,it not you a that been
0,i am in onc you from me
0,have to in my to it ha a
0,all the
0,then i
0,
0,the of is in which of i will be in
0,at been on all
0,you
0,no did you them or
0,how it will
0,she can me
0,same as y me do now
0,that the
0,is it
0,i out on my
0,we to that the ha a were the
0,it i but i too so i i she me
0,so ani you can from your up befor
0,on what are to
0,off
0,i my now have a
0,i just some so have that you it or the other
1,your for
1,we are to you have won a
0,do do it me we have a
0,i to
0,i just out that we have to my up from the that so do i be out at all we should to out of
0,then what do i it to my
0,me when you the
1,me a my or to to
0,you for the
0,thi is a a do do do a as do thi again
0,it it wa to you and you i to and a me hi
0,that
0,
1,for your to your will be by or no if you no you will not be
0,can you me a when you thi to to you about thi on the
0,all just been again did
0,but am to what to do are there it
0,my do
0,
0,not a ha here veri is at her and is just me and in at the how have you been
0,you will to
0,o not but i can with no more my
0,but have i will it a so not him and will is there
0,a from be
0,to
0,i am in you
0,her then
0,a in both are in all are
0,i will for it on i so
0,you
0,how is her to or just
0,i but too me now so then
1,the from onli at to no your now
0,i now but have to for the to me
0,you not now no when you can me
0,on you
0,i to my i to be
0,they and it ha a
0,my a and some so on i you when they for
0,is my and for
0,the is not that and you will not after
0,is is is so be in
0,can you to to of and the the what the is and if she can there she should to for the same and it she her in it she will be in
0,but
0,i be down for that
0,y
0,what with you have you a and have you for
1,and up it now just to
0,i
0,if you up the so i can when i he me to
0,how i did as in
0,to be is you it
0,onli and so it veri
0,i but can a not do now
0,
0,how you my
1,from your or t
0,i will after
1,what you you out who it is a on from
0,how i after me you had
0,do that into i in my here
0,to you are so what
0,the with can to the to but the they have it when it
0,do you
1,we are to that you have won a from onli
0,no it not i and should be from my you not to have to with thi thi is whi i do you
0,
0,then can
0,how ha it been you
0,i not me now in
0,of with their they i on by d you and will be the of your thi if you you will thi to in
0,i them do you
0,i you you i can it i how your and if you are my i of you and you
0,at had to what about
0,
1,as there is an for you
0,we are a on
0,i to you up on that what you
0,
0,i in
0,me with and
0,your is
1,our is now the will just on your to from the
0,at we will
0,i to to when i but i do you me that
0,my that is for all other our so it will be for you ani and it
0,
1,how about in with for just your and to in the
0,it not a
0,so the is
0,me up at am
0,if i wa i wa
0,do you or to our and now if we do a of it just all
0,on my
1,have a who is with out who they who so on
0,of can i not so y where we i on but he will
0,me a to about it
0,ani you have had with me as as you my by my from your not at all do not me again or i will you to your
0,if i that i just again
0,
0,at me i d i in the
0,i she now
1,for now to your to
0,up
0,you should to do
0,i you will just her
0,do you whi between your so that who is for you those by your with
0,i but these i be a
0,no ani what i should
0,there how up
0,how is your
0,i to but no is there
0,no on when have
0,he
0,i which it on
0,no i will to your
0,whi you off i so i to
0,is and me that is up the as we
0,when you on over
0,on
0,with your
0,s to for
1,you are the a or a to no
0,i it all in my
0,the who is for
0,that a of is i it
0,she me now
0,i had been i not have to you thi my is and i have for it my are it a i and wa you her the is is there a i that from you when i to
0,to where the you are
0,i been there befor you to for the i can up to
0,at ani
0,our i she haven so y so not by
0,thi is my by
0,what out were to me
0,where you
0,are you to and in
1,you now your for your now on t
1,here is your to further
0,no
0,
0,i to that can is not
0,i had it me to
0,it into when thi
1,of for our up over that is a
0,
0,some to our befor
1,whi have you to my i and to from to
0,i
0,i
0,for
0,there we have now our be if up
1,thi is we will be you a in a of which will you an to all the
0,i in now
0,more of the i you
0,i i into now but i it i
1,you won you a in our now
0,for each other each other and
0,me how to there and i do so
0,
0,do who you and who you are and be my
0,where can
0,i you i wa up and in i you your i you too
0,onli onc then after all your
0,just off now
0,i an but i off i up in an or
0,
0,no can me
0,there is it an in the of
0,up in a on a the
0,my
1,you have won or a to
0,you thi but i have off at
0,are you what to thi
0,be at your in about but out for me
0,the is that in but in they just you now
0,to and about that
0,should i you
0,to is by and with off
0,to through and
0,he is a
0,on with a
0,if i there befor you after your and so me
0,is if the is at they the for at
0,we it out then
0,she wa to be but it she in
0,a while again we in a
0,so we can
0,did i to you i you i you i you but most of all i you my
0,where are you i of you i you
0,i don i that and that it no the or a to them
0,be here in a if you to
0,it just the of just it
0,i for the same me when you there if you there
0,but again
0,i no as he is a and i for him so i will and i just you to i be into your
0,i or
0,i will them to your do you
0,i a is
0,i wa of at no to at can to me when
0,
0,no it of
0,or for
0,have been into my if so a when i my i do that
1,up your with a of a a to
0,now your again and do you have ani there
0,thi is a
0,how about you
1,you have won a or to on it a do
0,i will
0,that wa but do it you can her in
0,have you your to
0,i to you your is my
1,you are a have been or a to a
0,not you my you to your my and your to it do i your too
0,that
1,for the now with the with on your for a just with now
1,you have been
0,we
0,have the most we have to up at wa the the other i at
1,i have won do i do
0,so will those by now y he so between
0,and by when you i now
0,i my up
0,no so if now i my
0,ha the you in the same ha until you are
0,of again for the not a
0,it just that the that all you and is for me to is the same as when a is to me over and
0,no i will on the
0,you just my
0,i it so i should it on
0,i to a it a of is no to my
0,i my so me at a not
0,my there if
0,i it in your or
1,your have been up for your is
0,do i how it is that i be in my with a out in the of the that ha to me myself
1,all with to
0,ani we up
1,of to now t
1,a by a to no
0,to on a with in a
0,but you are the and the
0,wa in for that so ani other
0,my wa not to have do you
0,
0,what out until or so
0,we have all so not
0,what are you do in but i be in by it be at when do you and
0,no have had from you and while i am in the in a whi there should be an of not not when it to for veri
1,thi is the we have have won the is now onli
0,i now
0,what are your
0,no on her i it now
0,i in a you when i to
0,in when you just a not it the but while the in the will what your is for
0,now to me a onc
0,i will be you at
0,you have all thi
0,he be at in
0,on where
0,can you me that in
0,the at
0,it to from you
0,in now for
0,what
0,i wa at now but now i so then i a i but where now
0,if up
0,a few are me about you you at all thi
0,
0,were to a here
0,were on
0,yourself from for your with
0,been up it at or or
0,i the same just about
1,your are to thi more in
0,the most have the same just have the of their
0,
0,i so to you thi when all i to wa i you have a you in the
1,do you a ani ani or now for am
0,i in my
0,now i m the
0,have you for
0,now i a down me if i had a few down me
0,i no i but as am to about again are you on
0,my my after
0,my again at
1,of our to
0,is in when me up
0,can i your on
0,should i have up a or
0,
0,on in a
0,of
0,no i am that we
0,it
0,my it on
0,how i she in now then i
1,at a befor and or with and out a
0,of a
0,to it
0,just to you were about thi
0,a now but i when i
0,so then
0,where your when i it
0,how you and how did i wa just to if you to do not that i to myself or
1,
0,i him that i it that should i re it
0,you a
0,i i up to if my to in i about him when it
0,i
0,no he did is
0,
0,of doe he have ani
1,from to no your from onli
0,how you are you
0,to
0,i you of as my wa on the i am a
0,will have more off and is veri with
0,yourself how up on
0,
1,do you a ani and or now
0,but he is not a
0,my and i
0,i wa about you just that a and you will have onli the in that and is your
0,i you are i what are you do now
1,we are to that you have won a from onli
0,no he
0,how have your been so thi a it that of
0,how your
0,i did you
0,when i have to you
0,we a here
1,
0,i it that me i him you have to about
0,no i we that out an after we to as ha ani in out befor the
0,to on the with it
0,it they i had off so they re me again that to
0,my is have a
0,i that am on
0,up her
0,now that you have just for more and i that can you you a
0,into you i you so i can it
0,they that just had a
0,whi do you
0,it in out of
0,so are you that i that again or it with
0,you
0,you to up now
0,to him it not hi it the
0,how are you
0,
0,the is on the with a a up with a who in the
0,i in my my in me
0,up in onli which with
0,for ve you
1,ha our and your you to out who it is from a
0,what are you of
0,no ani her i her
0,should i just to up
0,to at it
0,my how that thi i and my on the down the but it i you
0,but
0,a who but is too to it
0,my how are you i are you be my are you my do you your
0,we can a in
0,me will do
0,i so i of so do
0,i for at i you not
0,do to i be befor
0,you to up
0,have i now so
0,do is an of is can it have a
1,you have been to a befor the t
1,the is for t
0,but you were so you should be about him
0,but be a
0,my
0,at a to
1,a to or to to
0,will down as i and
0,my which in me i to in i ll my for
0,i to in so me i so
0,i do whi not
0,that wa a i you that to me
0,but just and to not at thi
1,a is for you our ha you from our to a just
0,same here
0,if i an from you that it and to a
0,no that whi i had an on the have but i i thi
0,the is of d of the it will in
0,do now
0,but a now i
0,in for to out of my so i can a
0,yourself that of of in
0,whi i in between you
0,the is be but is in up if
0,have you to up and and i you it when you
0,onli until i
0,if for a you it it i an on for
0,you have you to on a
0,how
0,have you or wa a
0,is to have
0,i at now by the
0,no i a but i i a
0,
0,he that he had a when he again you be the from but how you for
0,where you you in or
0,you be here befor
0,we were for and i my to them up it at am
0,you are on the the on my and when i my you are all that out i of my you then my are out too a of for me of but i all you just and and when my here is you and i
0,ha she more than she in ha she the if she ha and it and her is then no
0,and
0,do
0,then me then i
0,veri for your a not
0,he me is then i it my we i if or to
1,you have won as a our ha you to a to is just
0,she i you
1,a is up is to now
1,as a a will on of a when are the to
0,can but of
0,no how the
1,are to the in the for until you to
1,the is now is to to to
0,i and is my how about you i
0,me when you here
0,do the in them so out the
0,i so i can about can you the same
0,a a is and you a for
1,the and the of the to be the
0,i be to up befor and what what
0,i will for my me
0,i am for
0,not to do here m the do for a that
1,thi is to you by and is not to the
0,as or it
0,should i him a or should i him or me are you i should the and what are you about the about the
0,or about no
1,is you to be her or her to
0,that is as
0,do ani by in
0,i wa just to
0,i
0,no onli
0,in
0,wa and on
0,i have it so
0,you what you i as a
0,is that what you me to
0,if you do you and
0,i you when i
0,i do
0,then i at
0,you are those you
0,how is for is i a for
0,no you just a to it out can me to do the i o
0,i do what is the of not i now
0,the it my and all i is
1,not from a while me now am here all with just my on me for it did
1,out about your now for to onli after each
0,now
0,can you me at the on it should be on the
0,whi it in yourself just and there is to
0,you
0,in
0,me
0,her i my at
1,we are to you that you have won a onli
1,thi is your to your or from
0,i if i all how
0,i be to do my
1,your ha been with a from onli
0,
0,what but i to a i her so i her up at
0,and
0,to my and i to him be
1,to off for will be up to with the and to be to
0,where i be my the me and i but hi
0,i how you are that i by
1,your ha now or thi
0,i that to for
0,i now all so he that we
0,that the me if i you do me
0,re
0,so that some
0,to i onli in
0,here for a while
0,i in now so i down
0,is the the wa on as all are
0,what the
0,i out then it or
0,i you you are my and
0,by the i a the of the so you can which it is just up befor it
1,we who you that you to out who
0,will they a not they will not until we our into the
0,that not
0,i you veri
0,on my
1,and on on or
0,of in
0,i at all i i how wa your did me
0,at not out
0,i a of to onli
0,if i to will you for me and not to from
1,your no wa a on thi is our to you
0,
0,you i to the
0,are you you do here
0,to at the in hi is at too
0,my no in me if
0,i onli
0,and i him off a so not him out of the for
0,
0,too to my if i will be with me
0,the and then for the the i you
0,my
1,from more more
1,that you have won or a now to t
0,a but the onli
0,i i just
1,in on to for or for
0,for as some
1,a or to
0,we on now we a we more to
0,no not i me my so i can
0,we can by onc my up with hi
0,to the
0,when you you were about not for
0,is i be to all for
0,me i in
0,you did have to me that now i he to all your
0,the is it
0,the over to to
1,thi are now just for onli
0,we to we no on there to if we on
0,me a about who i when and how
0,i have that in
0,that i by
0,too i i have the i did i have or have the
0,just to
0,he be so i be up there
0,me
0,she wa
0,how is my no for me thi how you my did you your
0,i by then if my out
1,do you a with to ani or
0,of in i
0,the so i be by
0,my to and had a with
0,i now
0,no am on the but have of so am my out
0,
0,is then is the of if you s to
0,i will her to out it been but we are will thi
0,i just been a under the so i of been at
0,after her and her over while she the
0,wa at i there were in the and as a
0,i on
0,i will you
0,but not but i then again if to then i as
0,he is to with and he me hi he me which he did and i will him of that if
0,me you
0,at now you
0,i for an my is
0,i wa about to do it when i i a and and
0,then
0,be there if it just in a just to be i it
0,just now your
0,so for our a not
1,we to a to you but were to do so to
0,wa the
0,i in of on of
0,have a
0,her so i me
0,out
0,she to from you how are you my
0,at just to out a
0,whi are up so
0,who were those were you in a i you were do that you me your
1,to up with a thi the
0,no
1,for your of a from you been you can do whi not a in a
1,a or to
0,
0,then
0,i am you them
1,to to your of the now
0,in if we we can my
0,up we do have that
0,it will be
0,my onli
0,we on for
0,do you with your
0,as in are there ani for me from that a but on it
0,that the are no the i wa
1,you are be off your from for onli
0,are you with your in
0,down ani you can
0,you
0,i am so i
0,for up the
1,it at all i will at over
0,what you do how are you
0,there in
0,you are have a i to it to your that i have been in for the few and have had to a i it be of me to about you at to yourself and that whi i up i am in a and be to the thi my of can you you for
0,y where at it just
0,no me do the your not at it
0,i am of on had to had a of
1,are to the in the for until you to
0,i not
0,so my me up at
1,you have your
0,i i can me now
0,so
0,is while a is in of d me me
0,are you to
0,that
0,s the
0,in
0,i have the by and
0,i until i my
0,i am in your
0,i if me or if me but me me me
0,me that i her
0,so am i how for an
0,i from
0,or i
0,he is for
0,did you in
0,where are the they are on the
0,how are you
0,me
0,we for an at how
0,is up then
0,is of a
0,i have my my she me a
0,a or
0,we were now
0,i do i can up here me if you me to down and
0,
0,
1,for but no or
1,thi in our to now t
0,but i at
0,veri will not but will be
0,you are a
0,how hi i did he until i
