target,text
0,be there in a
1,is your out whi there a you
0,your is
0,how are i have i been up a with the it
0,what are you
0,me when you the a of me to you about a
1,thi is our to your from is to now
0,am on my
0,it i have
0,did he just is
1,or with to now
0,i ani with out the
1,for your with no
0,i am in on the to
0,i me is
0,you in
0,where
0,who there to our
0,ani on ani
0,him when he so can
1,or more the
1,and and in all with
0,we our we are
0,
0,for
0,is a
0,i just befor and i you be befor
0,your
0,there is that your
0,have to about it you
0,i that i wa with you you you how you are how you to me how i you in my
0,the ha been the i other but he as and doe me there and i be up there
0,than that if the where i it is
0,we you over so it not too
0,i will onc i
0,so do you have
0,of for and the same is for
0,is do in he is
0,so i more onli i more
0,i will we
0,when should i the over
0,do you when the
1,your a from to your
0,or can you her and her if she can for me
0,out my are for the and be so to and that
0,how are you my are you with your to with him from the
0,no i not i you you and you do for yourself on own you more than i do i i a i the i my i and i did for i have to them i m up to
0,will is
1,not too to for to your befor
0,we on the from where we you off
0,some are as as you
0,and by the you do have more in your to out for a
0,to where you at
0,but i i my
0,it can me a
0,is veri is is too is but be is veri
0,i a few i but i
0,my wa i to a with my who is thi then
0,it just so her on you me
0,just
1,thi at your to to
0,no i be into your after but for the
0,to so i had to to the to the
0,are you are you did you that i your i you a to you from the
0,to than
0,are you in the
0,have you who at
0,i you a a few to you to i wa you but a is not out after you to you to and if you to
0,it is a i now the to
0,you and it been is your down
0,a not becaus of the of but becaus of the of
0,i
0,when i wa no when you were
1,will on of a when wa to
0,you to for if we at then can and the
0,i no at what is a but i
0,no i
0,i
0,do to me with them at after
1,thi is the to have won
0,is a in so veri to
0,we not then we
0,
0,have
0,not up on some thi is my by the
0,wa just about to will thi that whi you did all the we you on
0,on the i wa if your to we a and of
0,a be i of and befor ani of
0,my is on
0,thi is if my me if so
1,a by be an of the more for more just to
0,i wa as i with so they had to of me
0,it it wa me it wa or me i
0,i am
0,a few are at the i at the with and
0,i
0,we can up from him so we
0,so him and how is
1,of to now t
0,i do have i have up a to
0,so when do you
0,in
0,me when you be
0,they just it they ani other
0,my had to up for a
0,am at my in you
0,my ani are you me what do you do are you be and or and with my
0,your
0,me when you off do my have
0,what up about the
0,when do you me to down
0,me there
0,thi doe not in thi doe out while have then be up in
0,you to
0,or the my
0,there is a for
0,but a
0,
0,the of that the about and
1,for to a to t
0,i or
1,now to thi with to your just out
0,you are not me but you have to my
0,most to be in but so about i so me at me
0,it we a at the
0,did i have or from and ha which is in itself i on the and him to it out and
1,a now the just to to now
1,your for
1,a i to on
0,i am in the me will you at
1,you not ani more from the for to if with again
0,i that you were so by your i you it i wa do the i and you so about i i did and do have more to i i i your wa so
0,i i
0,he ha hi
0,there it i no
0,a i me up
0,you you have a and you both
0,can be if you have befor not to on if you do as do that
0,i on my to my then a
0,i at but not to you and
0,at the
0,will do again for out
0,you my do have a too
0,at so that at we can
1,you are be by our by you to out who it is from a
0,it here should i for
0,how she can it should to
0,onc me
0,whi is that i the are all you
0,i he be the other who their
0,i of it
0,i am a and will you with and
0,a i the
0,i will i to to after that i thi what i from her what to do she ani
0,as can me
0,i will
0,do it to of onli and are
0,can too
0,do i to at i have a to him until then
0,my here if then not
0,can you me a on all you about to here all you about and
0,will be out of in a few
1,ha been thi and until you in you it for me i you
0,thi is an not to do too
0,you at
0,there are me the
0,is to he can
0,it we can a while more ani
0,you you them
0,no to in
0,all and
0,be
0,there were
0,what off d thi now if do me a
1,is on the should a if do not on
0,in you up where i am i i have to of for should be befor the
0,i but too i
0,but it should have more
0,when it it in the of do your
0,i
0,you are have a just in
0,do you i can in a
0,i him to more
0,i it all through
0,if you have me to my
1,as a i am to you that of your no you are with a
0,what me i to
0,me
0,can not then onli how
0,up a where you can
0,me
0,i you up at about to to if you to
0,you so to of veri here you if not i to up
0,my is in so i not her so or
0,my how are you do when is there a befor you do
0,so it or as
0,no it wa that so i my me a on thi
0,from the i you about
0,s not a not a it a which i will be with you
0,so be
0,to
0,thi ha the
0,and have by
0,until onli in there
0,her out in
0,you to me befor i to that you for
0,is
0,so what do
0,me a to down my
1,your ha been with to just the to no t
0,what do out
0,i to and i you in some
0,i am on the to
0,i up out
0,is all the same as befor but and are
0,have to
0,when them to as as do but them so that they to be by you
0,too but few in but is if i it
0,of not a onli i not so
0,with me
0,can you the
0,i you veri but am veri
0,no a an now
0,ha that been the
0,but i have to i to have and
0,how do you to that
0,i my
0,
0,where been
0,by a do more of me other onc again i ll
0,thi is can i at
0,same i until
0,on it is veri
0,is up and at
0,they can they can in
0,i am for your
0,i am not at all with what you or do
0,my or i if you we or i some with my
0,at in my now so they
0,what in in
0,if you these it the same the they it
0,i to if am not i can them if they to so me what you to and how you are to
0,i if they are
0,have you
0,for your
0,i me when you
0,i had it with with
0,
0,then me
1,you to my they are so they were in the
0,we up at is it
0,than
0,me when you to
1,you now your a for your on
1,had your on to now t
0,he did hi we an
0,onli for for she is it then is the and ani
1,the to a the no from a or a
0,too
0,am for do you to ani
0,not i that but which
0,i in the
0,wa a and i wa and now or am i just when your i
0,not just some how you
0,same to
0,no
0,i i but my when she
0,but i
1,you have won a or a to our on between
0,her i
0,that i do to you
0,is
0,the
0,all will ani there itself
0,whi not is the all
0,is my me when i do my
0,can you it or do you to just
0,where are you what are you do are on the to your did you a that it i you
0,i you you your all i can about i when we will be
0,for the your out to some
0,no but me after some you
0,wa do my i you will you
0,thi is
0,but it so
1,for is your now all out
0,as from ha been to you
0,and
0,he in
1,with your and to
0,how are you i you
0,a where is the do to be but they will be in
0,i am on the to
0,i here
0,i did have it
1,the to
0,i just yourself and you
0,how doe
0,it not that you me it just that when all our on of it me over the you do how i over my
0,i just will
0,about on i am then but onli
0,is a
0,we
0,you in your i a few
0,a for not to with
0,had just
0,not
0,just out out to off my now
0,to my for i do me
0,the did some but i i be in and he it to for
0,i do he ha
0,she be i
0,or that on i them there
0,no i for the is it if i in an
0,no my not
0,i then she so i
0,i in
0,i you your did you to the too
0,me
0,i to should not me thi is the that you
1,you have won a thi is what you when you our to to now
1,to
1,your for with a of and onli with the thi to
0,and you and i we can up too
0,then me at
1,to have all the
0,i now but to i veri
0,am in a so if am at to be
0,then just a and for
0,it me for it that i just my to you and
0,her to if she it and doe then you her if she me
0,can you me my
0,and my just out the
1,do you ani and a for onli now or for
0,me how is
0,that be
1,i have had of these onli after i a to ani do you or
0,how just a
1,in i with if with me to
0,did out what the is at i to some out
0,it we up and our are to
0,i am not your
0,me how to you i you in a you are
0,so how wa
0,what you about me you me in
0,i your
0,will be now i am
1,a is up is to now
0,whi me
0,can me now
0,i my you are in me our
0,is but is of be onli in their
1,from your your or t
0,you in a
0,can
0,just the just off
0,have you been your
0,can i up when you
0,not
0,what the of in of to be
0,i in
0,now or you to i me
0,over to do some
0,now we not a then how can i the
0,to do in
0,her from she for the
0,if can do it too can do it if can do it do it if can do it him do it if can do it it and if can do it him do it if can do it a against it
1,
0,i her too
0,i have and and
0,you were but are so me a when you and i all is and all
1,for your your will be should your not from
0,and some
0,can
0,he is after in to out
0,at the what the you is up
0,just your my do have a
0,
0,until i can not
0,a with
0,you onli me you can ani but you a of or you
0,me up when you becaus i have to up with and he ha is
0,i is be
0,i have
0,by the to not have
0,we we at now
0,all of me i have no i just just for
0,i and
0,but not as have of to do
0,of
0,me when
0,to
0,
0,i i him
0,me when you the so can the
0,so we
0,have you been
0,my how that i your and and that you some i you a
0,i too we can
0,i how you my had you to the did you your were you on a i of you
0,just for if you the is not a so how it
0,what about thi then
0,him he out but i it have but
0,their a thi doe up at all
0,you you are so
0,to on
0,and now just out
0,doe not after or what
0,whi we and for to such a when the in there be
0,the is me you
0,my y
0,i on and to with you
0,me on from
0,whi you with
0,onli just thi not you i wa that is
0,will of you
0,should i be
0,do about have about how to it that you have
0,i will be you will be all your
0,how is the
0,i and you into me
1,are for you your by your as m or for your by a
0,you are
0,have to again
0,is that on the no it
0,there
0,so how are you what are you up to how the and so on
0,no
0,
0,if from a to or do not do so the it an of to of the no by ha been by
0,i be and i do to about thi i
0,thi been now about i
0,thi at from
0,now then
1,your for to
0,i to you will when i
0,did my
0,a too then y
0,i wa in
0,you a of to up
0,in the of the to
0,it too but it you the same
0,me
0,a they and i do ani of all that just do that be
0,then she no to
0,if you i can
0,there is no in my and
1,in just or at to
0,some a y is
0,no no for that after an
0,he doe is at me if it my my up of him of y
0,they are in
0,for me so you
1,thi will to on
0,i she me
0,you be in i to a
1,from now
0,i to but can you me how you and how thi is
0,no you in the
1,of thi to the we have our and these
0,o i
0,will
0,it you in or
0,ani other
0,just a with my at the a in a i that
0,but i
1,your for
0,no what are you do
0,from for me when over
0,i don t so you do to be out that on a when the you have is the you and a in on
0,just have where
0,i i m to
0,will d and to you do you have a
0,how to a it not at all to onli to be a veri
0,i did and
0,what you most
0,thi is from a in do not it
0,no how i out my
1,as as no can to
0,for thi
0,i be to all and
0,i out my
0,how should i
0,i in do you
0,you are me in
0,how for an
0,is
1,we to you re your to our for a now for
0,i can no did
0,a and it to me
1,have a who is with out who they who so on
0,of between is not about after the it about just by the
0,then
0,on with
0,if you to it or up
0,do you what did out now
1,have a who is with out who they who so on
0,that what i to you then
0,me to to or should i you
0,will thi if your here
0,of all to thi too
0,the just
0,i onli it
1,a by a to no
0,i out in a few you there
0,the i to do wa you and i did it have you be the and but as as i it wa up the that you i do it to you you do me at all it wa but it wa the i have with it is you have the to it but you not to you you you you to out i do a few here and there but when you do the when you on of it when i have a in the becaus i that there and on the on the that you to be about at the
0,you
0,he we just up and when they do
0,where is that
0,i not but for of me
0,the in our to and to
0,i onli from to but i which other
0,you should more if you there some i do about
0,no on they are me a up for some and in but be about
0,her if she me so i can have her in
0,to then no to in again
0,down on me
0,what you you can here
0,what
0,i the we for the with
0,your what i i to be a
0,s but not that
0,
1,our on between as you have won a or
0,o are you the
0,how are you do how the are you for the
0,how it to a
0,
0,is more than then but then
0,then whi you not
0,if by for onli for
0,i that what doe it
0,s if we have we will
0,it
0,i the and
0,i will there at just me which to in and can
0,if you me just to to
1,we to you re your to our for a of now
0,how wa i been and myself and veri for more what of do you
0,but i do i it there
0,me i not onc i
0,
1,are to a if you have a
0,have a
1,we have a your to your just
0,you you have to be in the i will you on it is when ha it
0,same
0,i there at you me to some
0,i is no down
0,in
0,are you with
0,what is is that you by her
0,out
0,those
0,now am you can me
0,are you to for
0,the i him i it and he i should not re it
0,what is
0,ha been to
0,all how i is i him
0,it not and thi i that wa the the is
0,no he is thi don ani of those is a
0,me if she a not
0,you i have now that i about it
1,thi is to the to from thi onli
0,am will be over all the
0,that y me
1,had your all on for no to from
0,you are have a
0,which the to it
1,you from all with a each to on to these
0,veri then
0,itself i that
0,that have him me a if he what he or ha ani
0,at
0,i will be i at to or
1,what do for how about a with now on to out more
0,where your at
0,not
0,wa a
0,with a a is he she is
0,where in are you are you with or
0,it onli doe not
0,i you i am you have to the to to me do you me
0,is not a to it is not a to it on and on it is and
0,what
0,what of that no from you thi on i of you
1,can of now the to
0,by the is to again
0,just a we
0,will do have a
0,it so that there do you she can and her and she be to and have i for the for her so just me when the that can me to the
0,i here in a and now my out becaus i i a in me and now i i you
0,most of the when i do you me it so i do into
0,and wa no
0,but it so i them
0,so is there i should be do with to or what becaus what the
0,whi she to to me
0,to you for the as it other
0,i have a now
0,how do you the
0,when is where will you what the and the do you have a in the all these are
1,to your
0,on it when i you for my
0,he is there you and him
0,i about that
0,there be a of in that or your a to in a now
0,just from and i wa to i i off on the if are up me a
0,just myself to a i not thi is he i when i down
0,i a from a i am to to i will in the
0,
0,is an that is as a of have an
1,are to a if you a
1,each on to for or on to for
0,i
0,can you at
0,i
0,will the of
0,my some y i wa to or
0,to you wa from the how your
0,
0,i the at the do or on not when my will
1,for to to t
0,all or
0,to hi in the
0,in for up and all and you
0,i you should the the it the that
0,than
0,the of it it can we thi on
0,he so i
0,the of a am as
0,if you up befor thi be a
0,i a
0,the of it
0,a we on the
0,do a in your for no and it to it
0,no but i out a
0,she just down a of whi in and i if she be or just
0,i been to a who all
0,my so am on
0,i will my
0,on on
0,as as can
0,no i can up with you
0,m in
1,to to your onli your
0,i
0,you the
0,do thi and am now who
1,now or to to and
0,are and i have for i did and
0,i
0,a of is my a of is my a of is my a for as my
0,the with
0,he about onli i
0,as as it can i them up y
1,you have been to in of for to
0,i y i
0,it you
0,it at
0,you can here
0,if you the me so i can to the i it to the
0,hi and for whi you that to him that
0,i on they i who will
0,i am in now to in a few
1,with for and or
0,i at
0,then you have a
0,what it where your at
0,i the but her you
0,where are you how did you
0,i wa of you of will you at
0,no i wa it all
1,to what doe to to
0,to me your do it again into your and me you are me
0,if you the
0,you and by the i just
0,for me there is no on i will my and you
0,up to then but i ani
0,to
0,there some by i at the by
1,in a for a to an to to t for
0,so i how and your
1,on at from a with to you by
0,and
0,
0,be there on
0,we not so i her now
0,and
0,
0,not to a of him
0,you that you the and i the you me a and i you
1,your no won a on thi is the to you
0,our not too of those at that of
0,i will be all from there
0,is he is
1,your for
0,but how you your to that it will when they you or you
0,then i him him
0,not on the
0,have do
0,i to the
0,did you to about
0,me when i can by and up i ani after all thi
0,onli to
1,more and from
0,to you too i
0,my have a
0,i in a
0,i for
0,whom you for
0,hi is my so do you
0,i but my have a and the how and i am
0,what of do you
0,i i the of that in you a to me you have been a at all at do have a
0,and by the it wa or not both
0,until me so i it more than so now i
0,both our so what are you for am i
0,
1,a if which the is in to
0,at what are you
1,onli had your you are to to the for the on
0,just by no
0,me at me which i am it
0,what will we do in the
0,do then
0,
0,what you you have it to when i should be
0,not that i am of now and of me at a
0,who just the other
0,had thi you
1,ha our you who now all will be
0,i am a in the and a in the is that you
0,if you of me then no
1,to to
0,it you who it wa with a your
0,wa to you the other been you
0,am to the in
0,i you did it
0,i you an to how now
0,i him in
0,a
0,where if in
0,after will from so veri
0,you me and all your in down if you
0,it
0,no have few to do be in
0,i have had more from i will them for you ha a for you
1,been not now to your we will them
0,is for in
0,i
0,will do you be at all i be to out of here a
0,that is
0,where where now
0,i you up when i some
0,me you have some of that you were about
0,when you just in the my and the will
0,have
0,me the
0,just you an to an with in it is that
1,you have won a to
0,have a at the in or a no a to be a
0,a it that of
0,i no and
0,what do at is it
0,no it not my y i if my be and be i can my it is
0,thi am in
0,can do
0,we with the
0,i as an from me for you to me at at
0,there to
0,is
0,i wa out now i him he then he who i wa he
0,that will under the do under the i do to a
0,what to our
0,how
0,are we do the i just a of to out at some from so i on
0,i but i and from to or is
0,or he
0,what should i my to be
0,that
0,we have
0,i so in with you i each i with you you me so
0,some
0,some at the are about how they are and
0,than if he it hi will or them
0,to the have a we you and you each
0,are you in you to
0,are you or
0,re your you did my
0,i just thi me with the
0,can you do a thi at some
0,i you when i off
0,i that i just did into i do be i that for in the
0,the up
0,now onli i am up
1,all the from and the with or to
0,my when you up in
0,no i to at if i
0,i am
0,i have i
0,all
0,it the is in so she the it
1,is now is who in the to
1,a if who the of will be her to
0,he will thi have been to or not i am in a
0,to
0,i a while me there or
0,have a to and the to not just with the but with that is to you
0,no i not i in so if we we
1,the that with to
0,i until when
0,doe have and should be to at
0,am in you
0,to me
0,
0,me
0,is to
0,y
0,out with my and hi
0,have now
0,will out
0,no no how
0,just a or to
0,a can have a that to for be an so the with your have a
0,i the on what other are we for your we to and our
0,you i can them
1,had your for to on or
1,are you out from
0,i did o that to you
0,the of on by in thi of it is a to be
0,
0,i my your after we them she you what to do so just we should them thi
1,out your
0,in i will you
0,he but he me but i not so they not
0,then me
0,a for your on my you for my
0,no
0,and for me now as you and the will what you are about and your and from you
0,
0,that all that
0,me
0,it is then
0,i your can you
0,i had a too it to do a with my for a
0,i to no to so have to
0,if we do have to a we to our to just to be
0,it it to you all
0,you i to your
0,until can
0,i but and i too to be to can you just some other to what you to me you can
0,by our at some so we can out the for thi
0,how to it to me
0,i i so i did ani all i wa to out i wa all and now i not
0,my it to from you i you so i your have with the but you for me
0,so
0,
1,our ha been by now all will be
0,just it up and to be her
0,i on my to my she
0,so i and you to me
1,you have won a or a to our on between
0,are the for of have you for the of it is veri i it is
0,i in now will when i out
0,no but you me you were befor you
0,i wa i some in but i just in i wa more dure the they it on the
0,no she i will and you
0,they do about my i now if i
0,i do i
0,from itself i
0,it if you it
0,then are you to
0,what you you have a to
0,
0,i should re the i had to for it
0,the that you you whi i your is i to do
1,of to if you do and a
0,i not you in a while thi is it wa and that you that we you i so her my have a
0,
0,can i
0,i you be as an as ani
0,i up now if
0,that i in to and she you been in are you thi
0,my and i did i it
0,can you me of when out i not in or
0,you a each more to you do it
0,i have you to
0,are you up for the i i am
0,i when we we have of to
1,for your with no
0,we had too i up
0,you some
0,it but had to off so we for him and it off at hi our is a you
1,you have won a or on on
0,how will i on you now
0,it
0,up for and myself a now i but at it not of
0,you are a you are so and i each for a but as a for and i i i whi but i i up to you i wa and i do have a
0,what i to is to again of thi
0,do how between
0,how
0,i the is
0,it a where you be more
0,do how i am i did to to the i i not a are for
1,from to no your from onli
0,it and it my of
0,no me i in the
0,is onli for i will for no for him
0,no and here i am
0,
0,you will the no for the
0,i you in ani
0,i the
0,i and
0,i him too but i he me i a
1,your for
0,you in a
0,what up how your hi to my
0,that will be you be
0,
0,is the the wa on as all are
1,your for to
1,off a with to to to
0,been each more to
1,your is for to
0,i been from all and for thi in up to me and if i so i the in
0,i am me if you ani of the i you the
0,d same
0,me him so
0,me when you here
0,i on the you
1,from into our just the to now t
0,i am in and have been up for
0,thi is it the it to i it for
0,but i in
0,i the other to but we can be by
0,i you had a i i had to you i and i a
0,it a or me to you
0,if we it no for
0,is a of a in d same if onli
0,here all then so
0,at to
0,what whi you i am
0,than ani i by
1,the to to
0,how it did you out where your for
1,for is your not
0,or have you
0,i not but not at
0,am not but am up to in so will when a more for
0,
0,you me
0,you at you should to out how ha for and and i are to out our
0,
1,on on or
0,am veri am the with the with the
0,here i
0,then
0,and or and as my to
0,you them your when you for at
0,i be at in
0,i to you with my
0,the
0,it to my it to and can
0,and i do on the but i be
0,i were i when i will be to you how i you the no me and to about i you
0,what me for
0,both of
0,have you and your off how are you by the
0,he not to ani if so for me
0,how wa did into to your all i had a out but me if can
0,at to
0,so
0,i where the is i be there
0,he in at and wa had out and she wa and he up in that but we there not do too you
0,it just that thi is is it
0,we
0,wa in the
0,for the is the of our for more on to and it hi a
0,you about
0,do it to be befor you becaus i just now out
0,so your me i been your and i wa me for
0,be but be all my with it a
0,doe a
1,with to or your of to t and
0,i you are do
0,how i in the all to you not
0,we at too
0,i my
0,
1,for to a to t
0,did you
1,how it so for a who is of the to a who to out all
0,to between and
0,for
0,i the
0,then
0,been up to did you have a when are i
0,you with in
0,i have no where you are
0,now to your
