target,text
0,of a wa my my me my so did my i to my did not as i my my i she me after she me to her we there she do if i into the for a i in a she out a my my my my my all and i wa on the
0,what me
0,i
0,are you thi
0,am to so am not to the
0,it until as out is that
1,with my are to a if your to your
0,i where are you i have to and my at
0,i in will
0,you are a veri veri veri veri or
0,no we it all so we have if then our to in
0,i on my own now my not
0,some of too not i i to
1,you can as with as you for more
0,i not it he can me
0,you i a
0,
0,y me
0,not i out of and i some
0,me when here my is up and i not
0,when did
0,that the you should
0,we and have to to are you at to in so to can in
0,it all o
0,i just a of and my in it and then my them out
0,to me a i
0,
0,i
0,
0,you ani
0,where are you you you be here when i
0,and of you should a
0,that
0,
1,will is off a out by
1,onli had your you are to to the for the on
0,i you when it in
0,that your i to be
0,my just if you him a
0,i am me onc you
0,just
0,he be to
0,how is did you to her
0,and how you will do that
0,your about me over not
0,what he is not the my some other is there
0,we at can
0,you a to be the to the not until they the i to be there to you and now i you but
0,i my if to then i
1,your your thi will our the to
0,in the she but it not will out
1,to and the with from with the out
0,not a in the
0,i be there with in ani
0,you are have a when are and what if can me a at
0,i i
0,it a
1,what it in the in can with to or be
0,i to you
0,so how then
0,is there
0,what you can at ani if you or that you will
0,and
1,from t
0,so what do you do
0,so to be at but onli veri few will to you your them
0,how my that my is a
0,i will your in
0,it if we some up from hi in an
0,
0,but onli
1,we are to that you have won a from
0,i in when they me
0,thi is my by
0,just of when himself
1,your to to no
0,he just for and he you it no
0,so the thi
0,thi in
0,your so
0,i to it i just my do me i onli a few thi thi me in them in wa an
0,so can
0,no ha you in their on it s a to to for more
0,my i will
1,to your to now t onli
0,of down to
0,i i your can you
0,we to and will after
0,i am for
0,at
0,do you or from me
0,it in
0,i not over do you
0,
1,a for no
0,i but i where you if me he me then i out all can so
1,of or to
0,i am a and will you with and
0,i now
0,what
1,do onli with our
0,no if you that it the
0,the is a from my you by it at and you have to
1,you are a you have been to or a to a to
0,it out i will
0,about is all no for that
0,that just do do an to be in at some befor
0,no have a at
1,we have a won an more so an on or
0,not to do
0,your is in
0,on then and for to the
1,ha been and you have been you can more thi
0,is not what we for it is the of what we do do the in the
0,now i out
1,you have a for you now to
0,to him it my
0,you my with the of i am in when the of the and it my have a
0,is
0,
1,do you that when you than you is an and than you is a
0,i should that i do and if you i can at thi to off but your if you it
0,i not while too to my
0,did to
0,that is than on by the if to to my but to as on
0,for when on i onli more and more and i i all my
0,am i that to thi
0,then what about further
0,i to just what
1,now
0,but you in with me
0,can to your
0,
0,i do you to but i do what i can to with you is
0,i can onli out at onc
0,off from
0,i you are can you the
0,when are you to your
0,we our not just to be from but to out who to the
1,is now the or a or to
0,i they that will my me not too
0,i as to my of befor
0,and is there a you can to her and she ha been too
0,do you where my
0,but not too me have now
0,but it will some to your
0,can me d
0,he to to and with the
0,i i do thi can an
1,the on now to for the we ll a
0,it me you are have too to thi but i and ha been at me all
1,is to now to onli
0,and that is the you in to what is on you i the same and they in and out the other while you off do you to do it not that you do whi i it that you do when i you what is to me then you to be when i
0,
0,the wa
0,that he at a so i of that she did are you him again do you to to can me all about
0,i in the and i am and do you
0,the for
0,i am at a with
0,so how do you the when the
0,i in a so me when you on the
0,here my i
0,up in so at at me the i now y just me
0,me if you or or how i
0,which is whi i to you ani of thi which is whi i so with you and as of
0,
0,again of
0,but i have been of all we have our at the
1,you have an from now
0,i what up
0,then is or for
0,am
0,they are to the at so here or there
1,from as there is an for you
0,my how that i you some on a i of you and you a from the
0,then we no
0,
0,is veri is is too is but be is veri
0,so then have
0,have few to do be in
0,that so now
0,no the which is on
0,in in when when to
0,we can all the of the
0,i wa out him me
1,thi is to the to from thi
0,my and are me and my are to the with a i by in an
0,i now my then i
0,you to into that after i have you through your have you me for a while befor i but the of that on your by the you who you my
0,you are how up
0,i did for the in a while i to not too after i with you up at how wa your
0,if you on your to that should and that should be
0,how did you out in a that did all of these
0,those were my
0,did you
0,been a
0,i do of of
0,i you are in the
0,so you i should to him not hi in the i to thi and he me where i and my he me how he i in how he not my
1,what doe herself to d or to now
0,how that what are you do where are you i my and of you my i a to you from the
1,your by to thi with the for
1,your to be on a now just is a
0,i veri for you on
0,i is have to
0,my can onli be i to
0,in or i
0,then to up until
0,have and to you
1,you are the a or a to
0,
0,just
0,we can some up you befor
0,for me the should with should that i her should be the which in my the and it with should be there i will be then when my ha her should will be to for all my and all her will be to with for will be in when i will be do the for will be when i do have to that my is the most on the will be for will be when i up and up will be the most and for the becaus she is with to a will
0,just to out when i to a thi we we but i did
1,we to you re your to our of a ani or
0,be here for a while you
0,as in
0,not in if we have to it
0,to
0,to do you for
1,of the of the in now by to
0,what doe the do
0,but which is for i
0,i we were do a of the there
0,in
0,for she to down then
0,me out of thi my to to
0,i have i of them up me whi i have had a
0,no is up with you
0,am is the of
0,i to you your
0,i am what are you about me
1,your no won a on thi is the to you
0,hi then he in not my
0,just up to
0,i your to
0,i
0,doe she to to a or no
0,no you to me to myself off a or
0,i a few of my
0,in some
0,these do have to on to
0,she to or she will more
0,the i just had to
0,my what are you do did you to that are you you are you be a do you of me are you me
0,no i did to it i it and so other i to you i it there it wa what i wa at the i wa befor i i then it wa there i on my when i to my it wa there you you did you were so whi that be the to at the
0,i to me
0,they my i to the will in to on
1,you have not the you have for to your
0,you the up
0,which then you me i will up after or i to my is
1,in now
0,
0,is there is for do you ani from your
0,is me as no
0,been on now on for a of a that i have at so to doe that for
0,all it to
0,or me
0,he an and from the there no i just they but no
0,i to be an
0,i in now
0,what and how
0,not
0,too
0,i to after so onli
0,i i in i so
0,i you you you me you some your i you i you i you
0,if do it i a
1,a if which in to
0,a a he she he her again d d a wa d it wa about d d her she so d is d of my d our of d i d
0,so it to be that they you in how are you just
0,there if you you will it have a
0,that to me in it in when it out
0,
0,my just the onli we do of becaus my the on
0,i be
0,in but
0,i that now be there in a
0,there a of my me to up and with them and then me that i a them too their do other so you how i
0,in which do you
0,when you
0,m but it not a here so it to from or or if i it
0,it not
0,of the be by but the of be onli by the
0,she off with a we will
1,your for
0,that a
0,in the to of that wa over and is to her or some i do i do here
0,i it wa i just too have to do some my and then have to again but you can me
0,of
0,she how are you where now
0,and
0,thi i you i you my with your thi to do it do it
0,
0,have
0,when should i over
0,
0,i
0,we are at i thi but i i am just then we on
0,to in of an me in
0,in
0,if d is d of
0,i i m to me up befor
1,to to
1,for your your will be should your not
0,i if i can by in a some to of here
1,to your or to a now
0,i her i had a she i i her it just a to be about but she did
0,my i of you and your did you in i you i for the we are again
0,it wa onli from but all now
1,are the a or a to no
0,in
0,it in the just
0,to
1,you are a or thi is our to you to now
0,to on your
0,
0,i my then i down
0,by
0,you me so
0,be wa the most on but
0,about that thi is my and i it
0,where are you we at and they not to out i of am but i should so can we out do do you
0,so how the over there
1,have a who is with out who they who so on
0,it no but to
1,with a from from a by to a after
0,now
0,i that is
1,is now
0,am i that
0,my i your not do do you your or your
0,whi we just and have
0,i to my some that just i
0,i will the most is for a i did for in they through so to not
0,now i
0,it if you can just or or that a more than
0,how do i with the me but
1,had your all on for no to from
0,i you an about how to into the you that should how are have a
0,it onli all at which is
0,not then did he or to
0,the is and i i have
0,i i from your
0,to have
0,i can
0,are you now
0,my my my my all and i wa on the
0,i in can you not on it to it now
1,you have won a thi is what you when you our to to now
0,but i no is too
0,did you that
0,where
0,i and you on
0,and
0,when i my
0,i but
0,me about you
0,me i am for your
1,for is your now all out
0,i you in the
0,me
0,no but we do to
0,we or not to to so in that
0,are you the in the or what
1,the if you are i in your i to
0,
0,i to you the how about
0,no to to me i i am an
0,no other the is on your i so i did your you
0,no i there
1,i am and i to you a to from me to
0,then
1,ha to to now to
0,a a of and you a of you to just so that you
0,did you it on what your
0,
0,i have my to i be if i more i not on
1,is on your to on and on so now out to
0,no you you been
0,of the
0,we
0,and veri all we is between and i onli
0,and same but do d on me i am from
0,how some of the
0,is your now
0,am on a from so i not
0,that the with that you a you for same same
0,ani where are you and what do
0,my to
0,i in now where are you
0,to by
0,now i is on ha
0,
0,
0,what i is do they you out when it over or is it you can as as you
0,for i been to that
0,be do and
0,i am for
0,
0,how it here by the been on with that i in so we have to up
0,i
0,i you you can you it doe it your i it doe my i you in your
0,i we out have some so in or
0,you t is all we we at
0,veri and are the now but i in
0,i can you it to me how
0,so it off of
0,you i did a a but with the other for
0,it ha now for her by
0,at is that on off by
0,i a becaus i through your and you in
0,
1,a of a of our to
0,thi is you your i not been in but that you are off have a
0,no
0,my i can by but i onli a for now where your
0,no but the can
0,we to then then she can
0,i him now
0,not have too me
0,that wa my in
0,the is same but i a now i i not too
0,i not at now
0,no few to
0,no
0,can to her
0,off to
0,or they all if can a not if all of them can it then i
0,i am to for an do in at
0,to up more
0,again for your when is in and the and my are not ha hi own so i to about how to my own
0,i if i can by in a
1,in on to for or for
1,been to thi is our to to
0,it when are you
0,i do what to do i of i you up and we can if they in the
1,between
0,have you not or
0,onli if you your out as as you can and you me in the to me you it in
0,are you in thi is
1,your or now s
0,i to but am not to i y
0,i to you a and i to to you about some to do with when and i but in i a to for that i is with you and i
0,a
0,no just wa
0,you have me i you
0,but i on my
1,a and a to
0,to him can
0,that over the is it a you have a here
0,
0,you are between i to out and
0,my me i hi i her i her
0,i a a
0,on not both of you
0,me here but i how about me when what
0,then we
0,my what about
0,i so until
0,i be there a after
0,of a wa my my me my so did my i to my did not
0,and for my i have onli in
0,no to do
0,me
0,you that you
0,to here ani after i you in a
0,how are you you a
0,what is your
0,y just were and me to
0,
0,me thi
1,your ha been with a from onli
1,we to you re your to our for a or now
0,d but the so with just them i
0,in while just him onc or and just hi and it just
1,your for to
0,where do up with these
1,i and to my a to
1,for or with me or more more
0,i wa when you had a if you to me i to a to but it over for them becaus their when you up that for me to to and the you me how to do that or do you some other to becaus they can from the ani be my
0,me when you
0,no is thi is a to i and a
0,i
0,it doe it on it own most of the it my but it a
0,up all as i a from did of
0,that becaus i
0,but is other is i she my now
0,it me to where you
0,not after in me
0,onli thi in then me the if d
0,
0,what of do you
0,she is our she our she is d of her who wa d our by her in it against
0,are you to and i of the
0,so i do a of
0,of out in that so i am will you
0,i in
0,than my just do my not what i but i will you at the
0,i
1,i do and do me to now and each other onli or over
0,i to i in i a but not
0,they do that the of are for the i did at all
0,just you
0,how you
0,on
0,my it if i by now
0,is
0,or me in a few
0,where
0,up
0,then some and i
0,we are to by from you up for
0,to the
1,had your or more to to the with for the on
0,me not up until in the
0,i be by
0,how are you do thi is just you a
1,for onli from a no
0,did if you by a or
0,i do i it me that do to me
1,no just to so now and
0,her the veri with of you can up to an to it and then some veri veri
0,i did a of on the i it
0,
0,
0,i it is
0,for be there for me just to to on you are veri to me i have you as a and
1,from or a t
0,i the what what are you do
1,can a or it up to just with
0,i to
0,then but i
0,to be
0,now we
0,ani i can
0,to to i a of
0,
0,which is becaus i i had it at
0,
0,you will be in the of that
0,i can but there not a in of up here
0,which
0,i with you in i can you me
0,
0,in
0,on the at the and i be until about do me
0,i who
0,can you just in for a there here i you to
0,to too
0,some is not just when them but when
0,is it me the
0,to your out
0,i that my that
0,you where are you now
0,do i you up
0,they if it it will or they are an of
0,to it to the who but
0,i to and for
1,a in your of are to now to
0,my a to me not becaus i my but becaus i the in my the them i them my
0,the just to you you are and off do have a and if you can me and
0,we from my on on on is
0,do you or
0,and a in me a after all the while the
0,on thi my i thi you and my i of you and a from the of you
0,i is it again
0,am in
1,to no
1,been to thi is our to to
0,me when you out
0,that i that whi
0,i not then i at
0,and after you from that have to my me and me for my are you your for that of
0,just a with it up
0,you you me
0,i have so that whi you so
0,with for ha been to the on at
0,i to and my
1,with from all
1,a if who the of will be her to
0,when now
0,now
0,if if if what are with your
0,you your
0,have a to for your will you to the did you that i you i to you
0,i at
0,both of do same but i can of where or in
0,onc again
0,or that
0,at the there if you can up some and to the a
0,that it to in is that
0,i you i you i you i you i you
0,then
0,at a and i a i me that so
0,a he who i am then but he
0,no be some
0,of with off of my
1,your to be on a now just is a
1,if you do your will to t at if
0,no my
0,in be by on
0,he me
0,to again can for my again all
0,but in
0,to up
0,don no you
0,when can out
0,all will be in a few
0,i a onli thi
0,ha can more than a can now you whi all of are dure
1,what you you out who it is a on from
1,is to now to onli
0,how you been
0,no for the
0,that me
0,what up you had a do have a
0,i the it that you the will in about to but i is there in to me
0,i on your
0,did
0,for out for me i
0,i will up are you to your as
1,is you to be her or her to
1,as a you have been to to onli
0,my on my i in
1,thi is the to have won t
0,we are to that your for is your will
0,s not
0,on thi and it
0,a is in than you so more in a than with all that
0,i to up
0,so of but i my
0,for
0,at
0,i i
0,can not in thi
0,do you have the
0,now you at
0,a wa hi of
0,but they it
0,doe is a by i on at at
0,my how your what are you up to i and am for you is i
0,i it up so
1,you have
1,just to and we your
0,
0,on from to and again from to on i in no i to through
0,then had
0,it i had a that i had both i wa so not onli about the but them be i in my that he wa i not in the
0,d do is d of it d of a and who is she is d who can d of a
0,i my to and i had to do for a few i if you are of do a on her is me the
1,for your with no
0,you should now so how are you i to and and that whi i your a in
0,we it to you you in
0,s s to the after in
0,can you for you them off for
0,that how you to be
0,and some
0,it in
1,to
0,i you in the into a
0,is so a veri am the to all these your
0,over here you are not your out of thi in a
0,they i i so
0,do you are for me my my
0,it is and if you a and for you of so it
0,just up had a about so i now i about but i up for it
0,all at
0,is about the ha to a that the will and if you to more
1,from your your or t
0,you not that i not to becaus i do to after be i too
0,if an that i have can be for me to to
0,can you do
0,do i i i it in the
0,and in
0,how to that i at all on what i you
0,i will you in
0,
0,it but to ani
0,with for a be but a few with who you more than itself
0,i your
0,is is that that thi at is it now it
1,you your which is
1,the onli in to is now in the to now
0,i i wa too so i have
0,we should again
0,no but
0,are you out
0,i wa when i they but we it who at me
0,the in but it are you a to it are but all in all it a the is i
0,you up a or some how he he up in
0,with my who i out with a now were again it been than a
0,the is for i or
0,at now
0,with me i other then you
0,a of thi it
1,over in our and your on the of a to now
0,what to her the
0,
0,what up my own my at and just you are have a
0,as in up up
0,not what i but i the with you that be me
1,our ha won to or the on
1,to to
0,it with me onli now am
0,i you in i can you but you can me
0,to that
0,is there ani
1,i just the on your and
1,of to out then a more
0,to when you
1,a been or a to a
0,what to no no to her i will if she or not
0,that the have of and have a
0,i to on thi
0,we don no
0,it we a
0,i too not me it where
0,she to but
1,for just to and
0,y to i not
0,
0,
0,but i at i wa of to i of at
0,i be in i in it at
0,just in
0,out there the in of some where out there where
0,you should i you can your now to not but if there i can me but when you do be you are
0,i my now
0,so what did the about the
0,i be he did a in between
0,how are you
0,at the with and
0,at
0,it so how do how wa so me did if not do it now
0,i
0,for the
0,he same
0,so
0,all wa until thi with my off be as same as
0,i you to him now
0,we
0,when my they to they are they that to my
0,i wa that too
0,my in you a
0,it i if you are at but me when can at all
0,now i onli
1,your wa a on our
0,just in on you do do have a
0,just to be to you
0,thi is so so so i you there befor me
0,can by up from other if
0,i for an to be in the
0,what are you do y no
0,not to i in
0,do the have a
0,we are out
0,i just been to the of and again and
0,my is
0,if will you in do you but you at then
0,i
0,for you have been you the
0,but your onli
0,in will the i can or the that can not
0,no no thi is is
0,i am in i will in
1,with are to a if you have a
0,no i a wa with me but
0,i in my
1,the ha for or
1,you have
0,no
0,thi is from how are you
0,i that wa your that just so more now and the wa the on a you me wa that how you on your and did your with you for that with your
0,
0,but your not here
0,there
0,where at were too
0,with the is or with who is to is if if
0,me my
0,it
0,which in as as a in or the is
0,i through thi it wa my to you out but if you to do that than the so i do have to no to then that the i you to be so you for onc how i when i have a who to and i have to no as thi i i do what to do
0,me how are me do there to
0,where did you
0,veri i too i too on so
0,i will be there you it
0,of all the they in an they they the by their all out of d onli he it is by my
0,on
0,now be
0,we up for
0,i not so
0,i
0,did a for i wa and all
0,how it a but it a to thi
0,i it
0,you at the
0,it is should be at thi of
0,is in
0,my is me them on my
0,no i
0,then she
0,to my me not
0,no but we a to some on now can i in
0,what do you do my i the of your to have from you did you out of on your
0,i that in
0,to some
0,y thi
0,for she in
0,wa the than
0,if your not too out and to my
0,i will you
0,my is of and i m do a where i to them i
0,my at
1,a of from or a
0,your ha been by your is your is
0,s in
0,i you when i on the
0,where
0,have i you i you i you to your in for those i you
1,can not the ha a of after more
0,not the will
0,you not have that to other
0,did me if
0,out
0,i if your i had to you i you
1,here a or with in to up just now
0,what are you do where are you who are you to do you of me are you be a are you me do you me
0,wa
0,d with
0,i if we more if can in
0,in thi
0,my it wa to your on and your veri my i my and you
0,s no for him
1,our to in for the you had to with to thi
1,to to
0,not had and
0,did that
0,just of our i it
0,or to hi
0,i so
1,had your on to now
0,i have to now so
1,from to no your from onli
0,i to if i
0,i did have a you
0,the will me the a or
0,i will be to to you you in the
0,i just are you
1,to from your just for t to out
0,so
0,those if it you are and you should for
0,it a to all if d same then which me the
0,i
0,will be but do be for a not to a on and
0,i to your
0,how you for
0,you for that ha befor if you do it just
0,again
1,for just to and
0,
0,
0,i my now
0,i my that whi
0,then
0,y i
0,so to be at but onli veri few will to you your them
0,i you too you it wa so to your i so that i it i i you
1,your for
0,i in now i will you
0,it to you while to
0,i wa and of the is on my if you i can him and if he
0,i about all up in my i that if i had it it now
0,now
0,you you
0,we are to to our you in the we can for after that
0,did the if not do it
0,we will a few by after can and again
0,that be the
0,my in is in but is but it i you a if you the ani for the
0,which is a who to or a who a about the he with
0,i an when i i in the and i at the i when you is
0,i will of will
0,i you will you
0,for of with the of all that you just did have a
0,i the i just you it to be a so it in that
0,it a of i just now about to to the who to
0,now have
0,for i
0,at all so i
0,just you in a
0,how it your not my just my
1,from your or t
0,on a
0,all
0,over will be here
0,just and then the as
0,how it here in it there is and but i myself
0,just me that you our
0,wa onc a and wa onc a not where but where
0,you so when we and we the of your you are we you we are down to
0,s but not to
1,for
0,all my
0,i have not it
0,ani
0,my in you are have a just
0,your what you to do on
0,don he is in
0,i wa can for then to i and there a
0,i my if your
0,and you i do have to have to do it
0,can me when
0,is i
1,these but no
0,i you on thi
1,a to your ha been you can
0,is then is the of
0,your at is so not
0,i to it
0,no
0,and you have to about me to you i you do you and i do the same
0,wa and when so a is you will a i
0,me that
1,to the a to the or to
0,i will do my
0,do now
0,
0,so what about you what do you
0,again but do some now
0,and you just to the and for the to be
0,how me an again no me a from
1,for just to and
0,that you
0,thi are we i am and you
1,on on or
0,you just
0,do you if in i she doe
0,
0,i all the at
0,by in who is the who but to it
0,i
0,i have ani of your in my i wa in when you you if i in my
0,i you i you i you i so you i you
0,on up the up
0,do you
0,you
0,that but
0,i of and
0,
0,do a of yourself now i with a and or
1,for your your will be should your not on
0,do you to
0,just so that you ha i just her a not to so it over you have to yourself in i should have on you in the so for that i
0,do you all thi
0,what do when i as a of my for what i will but onli to my of my that and no can you will i
0,if up just to my
0,i can you a
1,the and can have just up and the to now
0,it i to
0,can if have on have to is at
0,have you about that i to that again if it and a or it is
0,then had
0,i in
1,your when your when
0,how you ani your i of you and my the to you and
0,how and
0,not over some here
0,here of
0,from to onli my
0,that it i wa with now i did the but i of he not of
0,and them up from and they will do the and then them veri
0,the most my and me in the
0,is down but i have to it up from him so i by in a
0,so up ani how
0,
0,i it
1,there to to a a of t to
0,or him then i can
0,or or or
0,i
0,should have an
0,i have a on with will
0,me the other are for my to it that should in so i to be on
0,i
0,had
0,i to am to all the onli more
0,my my then i can it
0,of
0,my how it you so to for i your on and wa to them but wa you had i you
0,onli i to
0,i have a
0,my to the same
0,no to too y of thi
0,here while you were
0,there now i to a is it we off at have a in
0,no no what
0,
1,to no your of to from your now
0,is in or
0,i am to i am of
0,just up on you do have a
0,what up do you me to
0,down
0,what not under
0,if he my he is a him now
0,you
0,you been the
0,i too but and your on me if he
0,they were at but then they up and in
0,i to your now
1,a just now have you won
0,they to the
0,i have no
1,your a from to you t
0,same with me for the
0,how you i to you after i to you
